{
  "$schema": "https://json-schema.org/draft/2020-12/schema",
  "$id": "https://scope.dev/schemas/scope_decision.schema.json",
  "title": "SCOPE Decision",
  "type": "object",
  "required": ["decision_id", "packet_id", "decided_at", "reviewer", "decision", "decision_hash", "provenance"],
  "properties": {
    "decision_id": { "type": "string" },
    "packet_id": { "type": "string" },
    "decided_at": { "type": "string" },
    "reviewer": {
      "type": "object",
      "required": ["reviewer_id", "role"],
      "properties": {
        "reviewer_id": { "type": "string" },
        "role": { "type": "string" },
        "declared_expertise": { "type": "array", "items": { "type": "string" } },
        "conflict_declared": { "type": "boolean" }
      }
    },
    "decision": {
      "type": "object",
      "required": ["type", "rationale"],
      "properties": {
        "type": { "type": "string" },
        "rationale": { "type": "string" },
        "approved_scope": { "type": "string" },
        "rejected_scope": { "type": "array", "items": { "type": "string" } },
        "required_modifications": { "type": "array", "items": { "type": "string" } }
      }
    },
    "expiration": { "type": "object" },
    "confidence": { "type": "object" },
    "decision_hash": { "type": "string", "pattern": "^sha256:" },
    "provenance": {
      "type": "object",
      "required": [
        "scope_policy_version",
        "scope_policy_hash",
        "reviewer_key_registry_version",
        "reviewer_key_registry_hash",
        "scope_trust_root_hash",
        "identity_assurance_level",
        "identity_source",
        "role_resolution_source",
        "authority_checks"
      ],
      "properties": {
        "scope_policy_version": { "type": "string" },
        "scope_policy_hash": { "type": "string", "pattern": "^sha256:" },
        "reviewer_key_registry_version": { "type": "string" },
        "reviewer_key_registry_hash": { "type": "string", "pattern": "^sha256:" },
        "scope_trust_root_hash": { "type": "string", "pattern": "^sha256:" },
        "identity_assurance_level": {
          "type": "string",
          "enum": ["IAL0", "IAL1", "IAL2", "IAL3", "IAL4"]
        },
        "identity_source": {
          "type": "string",
          "enum": ["caller_json", "local_signed_key", "oidc_jwt"]
        },
        "role_resolution_source": {
          "type": "string",
          "enum": ["caller_supplied", "local_signed_key", "oidc_verified", "org_rbac"]
        },
        "delegation_id": { "type": "string" },
        "identity_claim_hash": {
          "type": "string",
          "pattern": "^sha256:[a-f0-9]{64}$"
        },
        "authority_checks": {
          "type": "object",
          "required": [
            "rbac_enforced",
            "rbac_role_valid",
            "scope_role_valid",
            "scope_approval_valid",
            "delegation_id"
          ],
          "properties": {
            "rbac_enforced": { "type": "boolean" },
            "rbac_role_valid": { "type": "boolean" },
            "scope_role_valid": { "type": "boolean" },
            "scope_approval_valid": { "type": "boolean" },
            "delegation_id": { "type": ["string", "null"] }
          },
          "additionalProperties": false
        }
      },
      "additionalProperties": true
    }
  },
  "additionalProperties": true
}
